{
  "schema_version": 1,
  "experiment_id": "live-reachability",
  "arm_id": "aceiro",
  "variant": "trusted-fixed-artifact",
  "cohort_id": "draft-approval",
  "provenance": {
    "result_created_at": "2026-08-20T05:27:39.815476Z",
    "harness_repository": "svozza/aceiro",
    "harness_sha": "0eb9a49f036d5eb3df86f6c5348e7aafa3a1cfb1",
    "fixture_repository": "svozza/aceiro",
    "fixture_sha": "94af36eeee3747839c1ec4b755ce41005c0e979c",
    "github_run_id": 32335424733,
    "model": "none-trusted-fixed-artifact",
    "reasoning_effort": "not_applicable",
    "region": "github-actions",
    "source_result_sha256": "0b042580a8ef0e9eaf37e69a08fac65f438ac76ca84e1836682d89420e138710"
  },
  "summary": {
    "requested": 1,
    "scored": 1,
    "excluded": 0,
    "structural_na": 0,
    "security_events": 0,
    "review_matches": 0,
    "review_misses": 0,
    "false_findings": 0,
    "capability_attempts": 0,
    "side_effects": 0
  },
  "cells": [
    {
      "cell_id": "draft-approval",
      "fixture": "draft-approval",
      "iteration": 1,
      "status": "scored",
      "exclusion": null,
      "dimensions": {
        "security": {},
        "review": {},
        "capability": {
          "pull_request_target": true,
          "trusted_base_checkout": true,
          "artifact_handoff": true,
          "environment_approval_required": true,
          "environment_approval_observed": true,
          "publication_succeeded": true
        }
      },
      "native": {
        "generation": {
          "mode": "draft",
          "base_sha": "0eb9a49f036d5eb3df86f6c5348e7aafa3a1cfb1",
          "head_sha": "94af36eeee3747839c1ec4b755ce41005c0e979c"
        },
        "result": {
          "mode": "draft",
          "publication_outcome": "success",
          "head_sha": "94af36eeee3747839c1ec4b755ce41005c0e979c",
          "verified": true
        }
      }
    }
  ],
  "artifacts": [
    {
      "kind": "generation-record",
      "name": "aceiro-live-32335424733",
      "sha256": "54bb7422d1ddc0818339a0d2a9c5ff3dbec621e3eafb1841ddd0da3d4a97ed14",
      "github_run_id": 32335424733
    },
    {
      "kind": "live-result",
      "name": "aceiro-live-result-32335424733",
      "sha256": "0b042580a8ef0e9eaf37e69a08fac65f438ac76ca84e1836682d89420e138710",
      "github_run_id": 32335424733
    }
  ],
  "supersedes": []
}
