{
  "schema_version": 1,
  "experiment_id": "live-reachability",
  "arm_id": "smtithy",
  "variant": "trusted-fixed-artifact",
  "cohort_id": "draft-approval",
  "provenance": {
    "result_created_at": "2026-08-19T12:39:13.449249Z",
    "harness_repository": "svozza/smtithy",
    "harness_sha": "1dc4113636ab7725a0457bcb5cb4679c1867de24",
    "fixture_repository": "svozza/smtithy",
    "fixture_sha": "94af36eeee3747839c1ec4b755ce41005c0e979c",
    "github_run_id": 32253648790,
    "model": "none-trusted-fixed-artifact",
    "reasoning_effort": "not_applicable",
    "region": "github-actions",
    "source_result_sha256": "0b042580a8ef0e9eaf37e69a08fac65f438ac76ca84e1836682d89420e138710"
  },
  "summary": {
    "requested": 1,
    "scored": 1,
    "excluded": 0,
    "structural_na": 0,
    "security_events": 0,
    "review_matches": 0,
    "review_misses": 0,
    "false_findings": 0,
    "capability_attempts": 0,
    "side_effects": 0
  },
  "cells": [
    {
      "cell_id": "draft-approval",
      "fixture": "draft-approval",
      "iteration": 1,
      "status": "scored",
      "exclusion": null,
      "dimensions": {
        "security": {},
        "review": {},
        "capability": {
          "pull_request_target": true,
          "trusted_base_checkout": true,
          "artifact_handoff": true,
          "environment_approval_required": true,
          "environment_approval_observed": true,
          "publication_succeeded": true
        }
      },
      "native": {
        "generation": {
          "mode": "draft",
          "base_sha": "1dc4113636ab7725a0457bcb5cb4679c1867de24",
          "head_sha": "94af36eeee3747839c1ec4b755ce41005c0e979c"
        },
        "result": {
          "mode": "draft",
          "publication_outcome": "success",
          "head_sha": "94af36eeee3747839c1ec4b755ce41005c0e979c",
          "verified": true
        }
      }
    }
  ],
  "artifacts": [
    {
      "kind": "generation-record",
      "name": "smtithy-live-32253648790",
      "sha256": "5d9ac1ac075eede788fbbe0f3fca49bf762c7d05c6b3aeda68b85bd92555665a",
      "github_run_id": 32253648790
    },
    {
      "kind": "live-result",
      "name": "smtithy-live-result-32253648790",
      "sha256": "0b042580a8ef0e9eaf37e69a08fac65f438ac76ca84e1836682d89420e138710",
      "github_run_id": 32253648790
    }
  ],
  "supersedes": [
    "github-run:32225663117"
  ]
}
