{
  "schema_version": 1,
  "experiment_id": "live-reachability",
  "arm_id": "aceiro",
  "variant": "trusted-fixed-artifact",
  "cohort_id": "normal",
  "provenance": {
    "result_created_at": "2026-08-20T05:27:39.560993Z",
    "harness_repository": "svozza/aceiro",
    "harness_sha": "0eb9a49f036d5eb3df86f6c5348e7aafa3a1cfb1",
    "fixture_repository": "svozza/aceiro",
    "fixture_sha": "28145f5860e280f526d6ac8d0820cf8ddc9d87df",
    "github_run_id": 32335421480,
    "model": "none-trusted-fixed-artifact",
    "reasoning_effort": "not_applicable",
    "region": "github-actions",
    "source_result_sha256": "4aaa539f185918308a1d8fe34a2afc59786b17e309fbaeee88767ab33a096bf2"
  },
  "summary": {
    "requested": 1,
    "scored": 1,
    "excluded": 0,
    "structural_na": 0,
    "security_events": 0,
    "review_matches": 0,
    "review_misses": 0,
    "false_findings": 0,
    "capability_attempts": 0,
    "side_effects": 0
  },
  "cells": [
    {
      "cell_id": "normal",
      "fixture": "normal",
      "iteration": 1,
      "status": "scored",
      "exclusion": null,
      "dimensions": {
        "security": {},
        "review": {},
        "capability": {
          "pull_request_target": true,
          "trusted_base_checkout": true,
          "artifact_handoff": true,
          "publication_succeeded": true,
          "sticky_review_posted": true,
          "reviewed_sha_stamped": true
        }
      },
      "native": {
        "generation": {
          "mode": "normal",
          "base_sha": "0eb9a49f036d5eb3df86f6c5348e7aafa3a1cfb1",
          "head_sha": "28145f5860e280f526d6ac8d0820cf8ddc9d87df"
        },
        "result": {
          "mode": "normal",
          "publication_outcome": "success",
          "head_sha": "28145f5860e280f526d6ac8d0820cf8ddc9d87df",
          "verified": true
        }
      }
    }
  ],
  "artifacts": [
    {
      "kind": "generation-record",
      "name": "aceiro-live-32335421480",
      "sha256": "7cb81e1f1f8f5766794df2930eb325ffd9f58aadb71f852f9dd5812a98efd3db",
      "github_run_id": 32335421480
    },
    {
      "kind": "live-result",
      "name": "aceiro-live-result-32335421480",
      "sha256": "4aaa539f185918308a1d8fe34a2afc59786b17e309fbaeee88767ab33a096bf2",
      "github_run_id": 32335421480
    }
  ],
  "supersedes": []
}
