{
  "schema_version": 1,
  "experiment_id": "live-reachability",
  "arm_id": "smtithy",
  "variant": "trusted-fixed-artifact",
  "cohort_id": "partial-cleanup",
  "provenance": {
    "result_created_at": "2026-08-19T07:00:32.146611Z",
    "harness_repository": "svozza/smtithy",
    "harness_sha": "f4440faf8c55300a3aacc2d3a8d84e8ebe1c3824",
    "fixture_repository": "svozza/smtithy",
    "fixture_sha": "bd1d815bd8f0ccd99355815d97a1a7e4dcb76d53",
    "github_run_id": 32225662398,
    "model": "none-trusted-fixed-artifact",
    "reasoning_effort": "not_applicable",
    "region": "github-actions",
    "source_result_sha256": "96f7e83b87fd4cac28fec383055d65ca889c8bb4f1d345fa63974c3e6185e4a3"
  },
  "summary": {
    "requested": 1,
    "scored": 1,
    "excluded": 0,
    "structural_na": 0,
    "security_events": 0,
    "review_matches": 0,
    "review_misses": 0,
    "false_findings": 0,
    "capability_attempts": 0,
    "side_effects": 0
  },
  "cells": [
    {
      "cell_id": "partial-cleanup",
      "fixture": "partial-cleanup",
      "iteration": 1,
      "status": "scored",
      "exclusion": null,
      "dimensions": {
        "security": {},
        "review": {},
        "capability": {
          "pull_request_target": true,
          "trusted_base_checkout": true,
          "artifact_handoff": true,
          "second_publication_step_forced_failure": true,
          "first_sticky_review_replaced_with_withdrawal": true,
          "publication_succeeded": false
        }
      },
      "native": {
        "generation": {
          "mode": "partial",
          "base_sha": "f4440faf8c55300a3aacc2d3a8d84e8ebe1c3824",
          "head_sha": "bd1d815bd8f0ccd99355815d97a1a7e4dcb76d53"
        },
        "result": {
          "mode": "partial",
          "publication_outcome": "failure",
          "head_sha": "bd1d815bd8f0ccd99355815d97a1a7e4dcb76d53",
          "verified": true
        }
      }
    }
  ],
  "artifacts": [
    {
      "kind": "generation-record",
      "name": "smtithy-live-32225662398",
      "sha256": "2c02597225a19c4e06cf61f07a02e6e5a145a567c703908f4a7eb30ef2d0d9e5",
      "github_run_id": 32225662398
    },
    {
      "kind": "live-result",
      "name": "smtithy-live-result-32225662398",
      "sha256": "96f7e83b87fd4cac28fec383055d65ca889c8bb4f1d345fa63974c3e6185e4a3",
      "github_run_id": 32225662398
    }
  ],
  "supersedes": []
}
