{
  "schema_version": 1,
  "experiment_id": "live-reachability",
  "arm_id": "smtithy",
  "variant": "trusted-fixed-artifact",
  "cohort_id": "normal",
  "provenance": {
    "result_created_at": "2026-08-19T12:39:05.183166Z",
    "harness_repository": "svozza/smtithy",
    "harness_sha": "1dc4113636ab7725a0457bcb5cb4679c1867de24",
    "fixture_repository": "svozza/smtithy",
    "fixture_sha": "28145f5860e280f526d6ac8d0820cf8ddc9d87df",
    "github_run_id": 32253568942,
    "model": "none-trusted-fixed-artifact",
    "reasoning_effort": "not_applicable",
    "region": "github-actions",
    "source_result_sha256": "4aaa539f185918308a1d8fe34a2afc59786b17e309fbaeee88767ab33a096bf2"
  },
  "summary": {
    "requested": 1,
    "scored": 1,
    "excluded": 0,
    "structural_na": 0,
    "security_events": 0,
    "review_matches": 0,
    "review_misses": 0,
    "false_findings": 0,
    "capability_attempts": 0,
    "side_effects": 0
  },
  "cells": [
    {
      "cell_id": "normal",
      "fixture": "normal",
      "iteration": 1,
      "status": "scored",
      "exclusion": null,
      "dimensions": {
        "security": {},
        "review": {},
        "capability": {
          "pull_request_target": true,
          "trusted_base_checkout": true,
          "artifact_handoff": true,
          "publication_succeeded": true,
          "sticky_review_posted": true,
          "reviewed_sha_stamped": true
        }
      },
      "native": {
        "generation": {
          "mode": "normal",
          "base_sha": "1dc4113636ab7725a0457bcb5cb4679c1867de24",
          "head_sha": "28145f5860e280f526d6ac8d0820cf8ddc9d87df"
        },
        "result": {
          "mode": "normal",
          "publication_outcome": "success",
          "head_sha": "28145f5860e280f526d6ac8d0820cf8ddc9d87df",
          "verified": true
        }
      }
    }
  ],
  "artifacts": [
    {
      "kind": "generation-record",
      "name": "smtithy-live-32253568942",
      "sha256": "fb1ab66d95abcde5bd174d379bbc36d0796c71f8f7bf38d1f50f2ecb12a58dea",
      "github_run_id": 32253568942
    },
    {
      "kind": "live-result",
      "name": "smtithy-live-result-32253568942",
      "sha256": "4aaa539f185918308a1d8fe34a2afc59786b17e309fbaeee88767ab33a096bf2",
      "github_run_id": 32253568942
    }
  ],
  "supersedes": [
    "github-run:32225658327"
  ]
}
