{
  "schema_version": 1,
  "experiment_id": "live-reachability",
  "arm_id": "smtithy",
  "variant": "trusted-fixed-artifact",
  "cohort_id": "stale-head",
  "provenance": {
    "result_created_at": "2026-08-19T07:00:32.076499Z",
    "harness_repository": "svozza/smtithy",
    "harness_sha": "f4440faf8c55300a3aacc2d3a8d84e8ebe1c3824",
    "fixture_repository": "svozza/smtithy",
    "fixture_sha": "a3e7f96f4f6b6b4031c4b2688a99dd6b047d85c1",
    "github_run_id": 32225659994,
    "model": "none-trusted-fixed-artifact",
    "reasoning_effort": "not_applicable",
    "region": "github-actions",
    "source_result_sha256": "ac54e001be5b6497abf3c841dd7f49373fcf10c50cf8981bace510b30a18b99b"
  },
  "summary": {
    "requested": 1,
    "scored": 1,
    "excluded": 0,
    "structural_na": 0,
    "security_events": 0,
    "review_matches": 0,
    "review_misses": 0,
    "false_findings": 0,
    "capability_attempts": 0,
    "side_effects": 0
  },
  "cells": [
    {
      "cell_id": "stale-head",
      "fixture": "stale-head",
      "iteration": 1,
      "status": "scored",
      "exclusion": null,
      "dimensions": {
        "security": {},
        "review": {},
        "capability": {
          "pull_request_target": true,
          "trusted_base_checkout": true,
          "artifact_handoff": true,
          "stale_revision_refused": true,
          "publication_succeeded": false,
          "writes_observed": 0
        }
      },
      "native": {
        "generation": {
          "mode": "stale",
          "base_sha": "f4440faf8c55300a3aacc2d3a8d84e8ebe1c3824",
          "head_sha": "a3e7f96f4f6b6b4031c4b2688a99dd6b047d85c1"
        },
        "result": {
          "mode": "stale",
          "publication_outcome": "failure",
          "head_sha": "a3e7f96f4f6b6b4031c4b2688a99dd6b047d85c1",
          "verified": true
        }
      }
    }
  ],
  "artifacts": [
    {
      "kind": "generation-record",
      "name": "smtithy-live-32225659994",
      "sha256": "b73f12f07f48ea29263314941d463a6349d846fd089c6aad1a1b22f6e5ad8122",
      "github_run_id": 32225659994
    },
    {
      "kind": "live-result",
      "name": "smtithy-live-result-32225659994",
      "sha256": "ac54e001be5b6497abf3c841dd7f49373fcf10c50cf8981bace510b30a18b99b",
      "github_run_id": 32225659994
    }
  ],
  "supersedes": []
}
